{
  "title": "La Carta",
  "description": "Todos los días de 12 a 23hs. Almuerzo hasta 15:30.",
  "status": "published",
  "order": 1,
  "icon": "mdi:silverware-fork-knife",
  "pages": ["/business/lo-de-pepe/carta/01.webp", "/business/lo-de-pepe/carta/02.webp", "/business/lo-de-pepe/carta/03.webp", "/business/lo-de-pepe/carta/04.webp"]
}
