{
  "title": "Platos Principales",
  "description": "Solo al mediodía y a la noche.",
  "status": "published",
  "order": 2,
  "icon": "mdi:bowl-mix",
  "pages": ["/business/lo-de-pepe/principales/01.webp", "/business/lo-de-pepe/principales/02.webp"],
  "styles": {
    "colors": {
      "background": "#f6f4ef",
      "surface": "#ffffff",
      "text": "#1a1a1a",
      "textMuted": "#6b6b6b",
      "accent": "#9a6b32",
      "border": "#e0dcd2"
    },
    "spacing": {
      "gap": 28,
      "padding": 32,
      "radius": 16
    }
  }
}
